{
  "contrato": "1.0.0",
  "cursos": [
    {
      "codigo": "15.09",
      "comisiones": [
        {
          "bloques": [
            {
              "aulas": [
                "101T"
              ],
              "desde": "19:00",
              "dia": "viernes",
              "hasta": "22:00",
              "modalidad": "presencial",
              "sede": "sdt"
            }
          ],
          "cupo": {
            "capacidad": 48
          },
          "docentes": [],
          "id": "A",
          "ocupacion": {
            "al": "2026-09-09",
            "inscriptos": 48
          }
        }
      ],
      "departamento": "Sistemas Complejos y Energía",
      "desde": "2026-07-01",
      "dictado_conjunto": [],
      "hasta": "2026-12-31",
      "nombre": "Agile, Lean y Lean Six Sigma"
    }
  ],
  "fuente": {
    "capturado": "2026-09-09",
    "sistema": "sga"
  },
  "periodo": {
    "anio": 2026,
    "cuatrimestre": "2C",
    "desde": "2026-07-26",
    "hasta": "2026-12-31",
    "id": "2026-2C"
  }
}
