{
  "contrato": "1.0.0",
  "cursos": [
    {
      "codigo": "93.18",
      "comisiones": [
        {
          "bloques": [
            {
              "aulas": [
                "001R"
              ],
              "desde": "14:00",
              "dia": "lunes",
              "hasta": "16:00",
              "modalidad": "presencial",
              "sede": "rectorado"
            }
          ],
          "cupo": {
            "capacidad": 48
          },
          "docentes": [
            "Cabana, Adriana Elena",
            "Peña, Nelly Haydee"
          ],
          "id": "A",
          "ocupacion": {
            "al": "2026-09-09",
            "inscriptos": 48
          }
        }
      ],
      "departamento": "Ciencias Exactas y Naturales",
      "desde": "2026-07-26",
      "dictado_conjunto": [],
      "hasta": "2026-12-31",
      "nombre": "Álgebra Lineal"
    },
    {
      "codigo": "72.45",
      "comisiones": [
        {
          "bloques": [
            {
              "aulas": [],
              "desde": "14:00",
              "dia": "martes",
              "hasta": "16:00",
              "modalidad": "presencial",
              "sede": "rectorado"
            }
          ],
          "docentes": [],
          "id": "B"
        }
      ],
      "desde": "2026-07-26",
      "dictado_conjunto": [],
      "hasta": "2026-12-31",
      "nombre": "Proyecto Final"
    }
  ],
  "fuente": {
    "capturado": "2026-09-20",
    "sistema": "manual"
  },
  "periodo": {
    "anio": 2026,
    "cuatrimestre": "2C",
    "desde": "2026-07-26",
    "hasta": "2026-12-31",
    "id": "2026-2C"
  }
}
